company_name,news_date,news_header,news_story
yes bank,11-03-2020,"Deal with bondholders 'in process', says YES Bank admin","A deal with some bondholders of Yes Bank who have opposed a state-led rescue is being discussed, the bank's administrator said on March 11, a move that could clear the way for a restructuring of the troubled lender.

""We are in the process,"" Prashant Kumar, the administrator said, adding he hoped a deal would be reached later on March 11 or 12.

Under the terms of India's rescue plan, set out earlier this month, the State Bank of India would take a 49% stake in Yes Bank, which is struggling with bad loans.

But some Yes Bank bondholders filed a court petition against the rescue deal, which would see them taking a write-down, according to a source and a document.

TV channel ET Now reported on March 11 that the bondholders had proposed to convert 85 billion Indian rupees ($1.15 billion) worth of bonds into 17 billion rupees in equity, citing unnamed sources.

Axis Trustee Services Ltd, which represents several investors in so-called AT1 bonds issued by Yes Bank, did not immediately respond to a request for comment.

India's central bank, the Reserve Bank of India, did not immediately respond to a request for comment.

The bondholders' petition was set to be heard in court on March 11 but the case did not appear on a Bombay High Court schedule.

Yes Bank's founder and former managing director, Rana Kapoor, was also due to appear in court on March 11.

Kapoor, who was arrested on Sunday and remanded until March 11, faces charges of money-laundering.

He denies wrongdoing and his lawyer said he had been made into ""a scapegoat"" due to public resentment at Yes Bank after the central bank imposed limits on withdrawals."
yes bank,11-03-2020,"Yes Bank share price up 35%, SBI may submit resolution plan soon","The share price of Yes Bank shot up more than 30 percent for the second consecutive session on March 11 after reports said State Bank of India could soon submit a resolution plan to the cabinet committee on economic affairs.

The stock gained 35 percent intraday on March 11 after rallying 31 percent two days earlier. The jump follows a 57 percent correction on March 6 after the Reserve Bank of India (RBI) put Yes Bank under a moratorium till April 3. Customers will not be allowed to withdraw more than Rs 50,000 from their accounts till then but RBI-appointed administrator Prashant Kumar recently said they would try end the moratorium the end of the week.

Over the last weekend, State Bank of India's Chairman Rajnish Kumar assured depositors that their money was safe.

SBI will pick up 49 percent stake in cash-starved Yes Bank, with an initial capital infusion of Rs 2,450 crore, and of its total stake, it will hold at least 26 percent for three years. Experts feel it gives enough confidence to investors interested in Yes Bank.

Kumar said they had been meeting lot of investors—domestic and overseas—and doing due diligence to acquire stake in Yes Bank. ""We will give complete resolution plan for Yes Bank in next few days,"" he said.

The Economic Times, quoting sources, said the country's largest lender, State Bank of India, could be preparing a Rs 20,00-crore bailout plan for Yes Bank.

The private lenders would announce its October-December quarter 2019 results on March 14, Prashant Kumar said. ""Our target is to make all banking services available at the earliest. We expect clarity on capital requirement in a couple of days and RBI will come out with final reconstruction plan very soon,"" he said.

He also said with the SBI, getting new investors for Yes Bank won't be a problem. “SBI's presence will give investors a lot of confidence. We are confident of stabilising things latest by April 3 (when moratorium ends),"" Kumar said.

The stock was quoting at Rs 27.40, up Rs 6.15, or 28.94 percent, on the BSE at 1251 hours."
yes bank,11-03-2020,Yes Bank stock appears to have become a trading play: Amar Deo Singh,"Amar Deo Singh, Head Advisory, Angel Broking, cautions those trading Yes Bank as there is still no clarity yet on its future course of action.

He also advises against trading at the current juncture as 'uncertainty still looms large', but feels it could be a good buying opportunity for long term investors with valuations turning attractive.

Edited excerpts:

Q: In January, we hit a fresh record high and now the market is at a 52-week low? Can we say that we are firmly in a bearish grip or downtrend? What are the important levels to watch out for?

A: Technically, the short and medium term indicators have turned negative. However, the long term charts point towards a major support zone around the 10,000-10,200 mark.

One needs to definitely trade with caution as uncertainty still looms large. However, it could be a good buying opportunity with valuations turning attractive.

Q: What is the way ahead for the Indian market and what to you were the factors that led to the fall?

A: The market was extremely volatile from March 2 to March 6, with domestic benchmark indices closing almost 2 percent in the red and many stocks being hammered in excess of 5-10 percent.

Negative global sentiment due to the coronavirus outbreak, coupled with the Yes Bank crisis, hit the market hard and shook investor confidence, wiping out crores in investor wealth.

In an emergency move, the US Federal Reserve lowered interest rates by 0.5 percent, its first such emergency move since 2008 in response to the growing threat from the coronavirus outbreak.

Other global central banks are also geared up to take any such measure that they feel can stem the slowdown in the global economy. The Indian market is taking cues from its global peers. Till such time that we witness a soothing of investor concerns and the coronavirus outbreak being contained, the market is likely to remain volatile.

Foreign portfolio investors (FPIs) have turned net sellers in March so far, after being net buyers for the past six months, clearly mirroring happenings across the globe.

Q: What are the important levels to watch out for on the Nifty and Bank Nifty?

A: Major indices witnessed very high volatility last week, with the Nifty correcting almost 2 percent and Bank Nifty by around 4.6 percent.

Technically, the Nifty has strong support around 10,800 and 10,600 mark, which is also its previous major bottom that it made in August 2019. On the upside, resistance is seen around the 11,300-11,400 mark.

The Bank Nifty has crucial support around its previous bottom, i.e. 26,500-26,600 zone, whereas resistance is seen around 28,800-29,200 levels.

Q: What is the way out for shareholders of Yes Bank? Has it become a trading play? Also, what about the funds that have invested in the bank?

A: Yes Bank shareholders are in for a tough time ahead. It is definitely a sorry state of affairs. Given the type of volatility being witnessed in the Yes Bank stock, it appears to have become a trading play.

We would advise caution while dealing in this scrip as there is still no clarity yet on its future course of action. As RBI is seized of the matter, greater clarity shall emerge in coming weeks with regard to funds that have invested in the bank.

Q: Any important event which investors should watch out for this week?

A: Markets globally are adapting on a real-time basis to events unfolding with regard to the coronavirus outbreak. Hence, we are witnessing heightened volatility for the past couple of weeks.

Investors definitely need to be alert as news flow could fly, thick and thin. So, adopting a calibrated approach would be best, till greater clarity emerges.

On the events front, the European Central Bank (ECB) meets this week for their monetary policy statement. Investors should pay attention as it has a bearing on global markets.

Q: What is your near term target for the dollar-rupee?

A: The rupee depreciated by over 2 percent last week against the dollar on global concerns. It would now take a breather and consolidate in the 72.50-74.50 zone.

In case, we see any new negative developments on the coronavirus issue, then that could be a trigger for further depreciation in the rupee, else it could trade rangebound in the near future.

Q: Which sectors or stocks are likely to be impacted the most by the coronavirus outbreak? Can IT and pharma ride out the storm?

A: A sharp correction in crude oil prices should help reduce our energy bill, meaning a narrower current account deficit India. Pharma and IT have so far weathered the storm, but one needs to be cautious here as well, given the prevailing global uncertainty.

Q: The debacle in Yes Bank comes close on the heels of the Punjab & Maharashtra Co-operative (PMC) Bank episode. What does it tell you about the banking system? Do you think this would weigh on financials for some more time?

A: The banking system is the lifeline of any economy and country, and RBI is taking all possible steps to ensure that despite the recent happenings, confidence of the public remains firm and resolute in the banking system.

The overall slowdown in the economy, leading to NPA issues, need to be addressed so that credit flow in the system is enhanced in the months to come.

The views and investment tips expressed by investment experts on Moneycontrol.com are their own and not that of the website or its management. Moneycontrol.com advises users to check with certified experts before taking any investment decisions."
yes bank,11-03-2020,Valuations still lofty for HDFC twins: Aberdeen Standard Investments,"Markets are going through volatility, many investors are sitting on the sidelines. So, at the moment, we are certainly not seeing money coming in, said Hugh Young, head of Asia Pacific of Aberdeen Standard Investments.

""We are not seeing open-ended mutual funds (MFs) -- we are not seeing cash rushing into the market at the moment. For us, it is more a matter of sitting on the funds we have, either rejigging our portfolio, adding to areas where we think have been oversold, maybe taking a bit of money out of areas that have remained very resilient. We do have a bit of cash in funds but typically that is a residual amount of one-two percent for eventualities and at the moment by and large we are sitting on cash particularly in open-ended funds, just in case there are redemptions,” he said in an interview with CNBC-TV18.

Speaking about Indian market, he said, “We typically remain largely invested. We don’t take major cash decisions when people have decided to go into a dedicated India fund partially because you never know whether they might have positions against themselves. So our portfolios by and large are fully invested. We do keep a bit of cash for redemptions.""

""One of our concerns has simply been that India is one of the most expensive markets and growth has not being coming through as expected. In India’s case - economic growth and earnings growth hasn’t been as strong as we were hoping for.”

“Broadly, financials could go through pain but it is going to be certain financials, which need to go through the pain. One of the issues, again specific to India has been that the financial sector is a bit of a mess and really hasn’t been cleaned up as it should have been. The silver lining in the dark cloud of Yes Bank is that things are being cleared up,"" he said, adding that as far the house is concerned, they have stuck with the quality end of the spectrum like the HDFCs, the Kotaks. However, the issue there is one of valuation and that one could see the valuation come down but they are not yet tempted to go into the lower quality end of the financial market and prefer to stick with co-holdings in the good long-term winners, said Young.

He added that valuations are still lofty for the HDFC twins.

“China’s market has held up remarkably well considering the coronavirus issue. One would have thought China would be one of the worst affected markets, but it hasn’t been. There has been support coming in for the China market but if anything, it has got more expensive relative to India. However, in absolute terms India still remains an expensive market, "" he said.

""I doubt there would be much major rejigging but given what is going on with markets at the moment, it is very hard to say anything with complete confidence,” he further mentioned.

When asked if he would increase allocations in Asian Paints, he replied, “We have been long-term holders in the paint sector. It has done fabulously over the last few decades. The holdings in that sector are far from cheap. The companies get long-term benefit from the lower input costs, so the house is comfortable holding them at the moment,"" he added.

Source: CNBC-TV18"
yes bank,11-03-2020,"After Yes Bank crisis, SEBI may limit MFs' exposure to AT1 bonds: Report","Following the Yes Bank crisis, the Securities and Exchange Board of India (SEBI) may limit the exposure of debt mutual funds (MFs) to additional tier 1 (AT1) bonds, according to a Business Standard report.

As of January 31, MF’s exposure to AT1 bonds is Rs 37,687 crore, the report said citing data from primemfdatabase.com. AT1 bonds, classified as quasi-equity instruments, are usually riskier than tier-1 bonds.

“The market regulator will take a look at the exposure level to such bonds in individual schemes. In some of the funds, the exposure levels are 20-30 percent of the scheme’s assets. The regulator is likely to question such excesses,” the chief executive of a fund house told the paper.

Also read | Explained: The impact of Yes Bank's AT1 bonds on debt fund investors

In its draft resolution plan for Yes Bank, the Reserve Bank of India (RBI) said that any instruments qualifying as AT1 capital would be written down.

Moneycontrol could not independently verify the story.

The RBI’s proposal on Yes Bank’s AT1 bonds suggests that preferential treatment will not be given to the bondholders over shareholders, the source mentioned earlier told Business Standard.

Bondholders have invested nearly Rs 94,000 crore in AT1 bonds issued by Indian banks, according to rating agency ICRA."
yes bank,11-03-2020,"Yes Bank crisis: ED probing NPAs of over Rs 20,000cr","Over Rs 20,000 crore of Yes Bank’s non-performing assets (NPAs) are under the Enforcement Directorate’s scanner. The investigation agency is probing whether these loans were disbursed after receiving instructions directly from the bank’s co-founder Rana Kapoor and whether the latter received ‘kickbacks’ for approving the same, a source told Moneycontrol.

Sleuths suspect that while granting these loans there was a lack of proper due diligence and non-adherence to norms as laid down by the Reserve Bank that led to these loans turning bad later.

ED will soon begin questioning officials from companies that have gone bad, with a source saying that the ""list of these companies may increase in coming days as the investigation proceeds."" The Central Bureau of Investigation (CBI) will also partner with ED in this probe.

It is likely to call its Yes Bank officials and its former Managing Director Ravneet Gill for questioning in coming days.

Kapoor is also suspected to have created several shell companies, some in the name of his family members, which ED suspects were used to receive kickbacks from the companies gone bad, the source added.

Yes Bank has a total exposure of over Rs 2.5 lakh crore. Of this, around Rs 42,000 crore has gone bad. The actual number of NPAs under the scanner could rise from the current Rs 20,000 crore once the true picture of Yes Bank's financials are revealed. RBI-appointed administrator Prashant Kumar said Yes Bank will announce its third quarter results on March 14.

On February 12, the private lender had informed exchanges that its Q3 earnings will be delayed beyond the regulatory timeframe, citing receipt of “non-binding expressions of interests (EoIs)” and discussions with “several prominent investors” for capital raising.

As per regulatory norms, a company must declare results within 45 days of a quarter end.

The investigation agency is also probing Kapoor's property in the UK and US, the source said. It has provisionally attached 47 paintings, including the one bought from Congress General Secretary Priyanka Gandhi Vadra in 2010 for Rs 2 crore.

Officials are interrogating Rana, his wife Bindhu and daughter Roshni at present. Rana’s custodial interrogation ends on March 11.

Troubles at the new-generation private sector started brewing ever since RBI denied an extension to Kapoor – who is in the ED’s custody on charges of financial mismanagement and money-laundering -- to continue as MD and CEO in September 2018, and had asked the lender to find a new successor.

On March 5, the banking regulator had put a moratorium on the cash-strapped bank, imposed withdrawal restriction of Rs 50,000 till April 3 and superseded its board through appointment of an administrator.

ED arrested Rana on March 8 after registering a case against him on March 7. The case also names former Dewan Housing Finance Corporation (DHFL) promoters Kapil and Dheeraj Wadhawan, who are accused of paying a Rs 600 crore bribe to Rana’s family.

CBI has registered a case against 12 entities including Yes Bank; Rana; Bindhu; their daughters Raakhe, Radha and Roshni; their companies Doit Urban Ventures (India), RKW Developers and Morgan Credits; DHFL; and Kapil and Dheeraj Wadhawan."
yes bank,11-03-2020,"RBL Bank says it is financially strong, well capitalized","In the aftermath of Yes Bank crisis, Private sector lender RBL Bank on March 11 said it is ""well capitalised"" and there is no adverse change in its asset quality. The statement comes in the wake of the Yes Bank crisis, following which stock prices of various banks went sharply down.

""The management of RBL Bank wishes to address the prevailing concerns around the bank which is based on misinformation, and warrants clarification,"" it said in a statement.

The lender further said that: ""We wish to re-emphasize that RBL Bank is a fundamentally strong institution. Rumours around financial health and stability of the institution especially in social media seem to be misplaced, motivated and not based on facts"".

The bank said it is well capitalised, has healthy liquidity, growth is on track and management remains firmly committed.

""There has been no material adverse change in the asset quality since we announced our Q3 financial results on 22 January 2020 and our guidance remains consistent,"" the bank said.

The bank further said that it has a capital adequacy ratio of 16.08 per cent with Tier-1 at 15.02 per cent (significantly higher than the prescribed regulatory requirement at 11.5 per cent and 9.5 per cent respectively).

""All our business segments are doing well, we continue to expand presence across newer geographies by adding branches and are also hiring more people as previously planned,"" the statement said adding that the bank continues to attract additional deposits from retail, corporates and institutional segments.

Shares of RBL Bank were trading at Rs 230.25, higher by 10.80 per cent over its previous close in early trade on BSE.

The stock had witnessed significant downtrend and had slumped over 30 per cent in the previous two trading sessions."
yes bank,09-03-2020,Govt has no plans to bring other pvt sector lenders under scrutiny post Yes Bank crisis: Source,"The government is not considering to bring other private sector lenders under scrutiny in the aftermath of Yes Bank crisis that has left lakhs of customers worried if their hard earned money is really safe in banks. ""There is no such plan,"" said an official source when asked if the Yes Bank crisis preceded by Punjab and Maharashtra Co-operative (PMC) bank debacle calls for scrutiny of other lenders also.

The official said that there has been timely action on part of both the government as well as the Reserve Bank of India (RBI).

""The bailout plan has also been announced, so this will be contained,"" said the official.

However, analysts expect that the new generation private sector lenders alongside the cooperatives could face slow growth in their deposits as the banking business is based on trust and confidence.

S&P Global Ratings said if Yes Bank's resolution process is prolonged, there is a risk the broader banking environment may take a hit.

""The uncertainty may engulf weak financial-sector entities, including non-bank finance companies or private-sector banks. Companies with marginal credit profiles, perceived governance issues, and aggressive risk appetites are particularly vulnerable. These could suffer from extended risk aversion, resulting in rising borrowing costs,"" S&P Global Ratings said.

Yes Bank being put under administration has further eroded the confidence in the financial sector in India. After IL&FS, DHFL and PMC Bank, this is a bigger setback given its size and profile, said Tarun Bhatia, MD & Head of South Asia in the Business Intelligence and Investigations practice of Kroll.

Brokerage firm Anand Rathi said deposit growth for select banks may slow down. ""The banking system is based on goodwill and trust. Given the recent events (including at PMC and Yes), new age private banks and smaller regional banks may see slower deposit growth, Anand Rathi said in a note on 'India Banks? Likely contagion effect of Yes Bank'.

It said although the regulator and the government have in both cases stepped in to safeguard the interests of depositors, ""we expect retail investors to park their deposits in PSBs and select larger private banks"".

At least in the short run, deposit growth in new-age private and smaller regional banks could therefore significantly slow down. This may push up their cost of funds, eating into their margins. Loan growth of private banks with higher C/D (cost to deposit) ratios could be slower, it added.

""The event raises serious issues around corporate governance in the bank but will now bring all other mid and small size banks under scanner too. The cost of capital will increase for the banks and there could be increase in asset side risks with growing concern on the quality of portfolio they hold,"" said Bhatia of Kroll -- a division of Duff & Phelps -- on Yes Bank development.

During the moratorium period, Yes Bank will not be able to grant or renew any loan or advance, make any investment, incur any liability or agree to disburse any payment.

As per the RBI's draft reconstruction scheme, State Bank of India (SBI) will pick up 49 per cent stake in the crisis-ridden Yes Bank under a government-approved bailout plan by infusing capital of Rs 2,450 crore.

Bank's financial health is not sound as it has failed to raise enough capital under the new leadership of Ravneet Singh Gill, who took charge as managing director and CEO from March 1, 2019.

Troubles at new generation private sector started brewing up ever since the Reserve Bank denied extension to its co-founder Rana Kapoor -- who now is in the custody of the Enforcement Directorate for financial mismanagement and money laundering charges -- to continue as MD and CEO in September 2018 and had asked the lender to find a new successor."
